{
  "$schema": "https://json-schema.org/draft/2020-12/schema",
  "$id": "https://autorig.dev/schemas/v1/rig.schema.json",
  "title": "Autorig Model Spec",
  "description": "Specification schema for Autorig Workbench model configuration (rig.json).",
  "type": "object",
  "properties": {
    "schema": {
      "type": "string",
      "enum": ["autorig-spec/1"],
      "description": "Schema version identifier. Must be 'autorig-spec/1'."
    },
    "rig": {
      "type": "object",
      "description": "Armature construction, skinning rules, and audit parameters.",
      "properties": {
        "kind": {
          "type": "string",
          "enum": ["tripo", "build", "placed", "humanoid", "custom"],
          "description": "Rig builder type: 'tripo' (reuse joints), 'build' (trace mesh), 'placed' (hand-placed with rules), 'humanoid' (standard biped), or 'custom' (script)."
        },
        "skeleton": {
          "type": "string",
          "description": "Target archetype name (e.g. quadruped, hexapod, winged, serpent, humanoid)."
        },
        "forward": {
          "type": "array",
          "items": { "type": "number" },
          "minItems": 3,
          "maxItems": 3,
          "description": "Direction vector the model faces in source coordinates before turning to -Y (e.g. [0, -1, 0])."
        },
        "straighten": {
          "type": "boolean",
          "description": "Straighten sculpt orientation exactly rather than nearest quarter turn."
        },
        "origin": {
          "type": "string",
          "enum": ["feet", "center"],
          "description": "Origin placement: 'feet' (ground at z=0) or 'center' (centred at origin for flyers/swimmers)."
        },
        "builder": {
          "type": "string",
          "description": "Path to custom builder script relative to model folder (required when kind is 'custom')."
        },
        "head": {
          "type": "string",
          "description": "Head bone name in source armature (tripo)."
        },
        "head_to_snout": {
          "type": "boolean",
          "description": "Extend head bone to the front-most vertex of the face/snout (defaults to true; set false for upright bipeds)."
        },
        "hips": {
          "type": "string",
          "description": "Root hips bone name in source armature (tripo)."
        },
        "legs": {
          "type": "array",
          "items": { "type": "string" },
          "description": "Source bone names designated as legs (tripo)."
        },
        "mirror": {
          "type": "array",
          "items": { "type": "string" },
          "description": "Bone names to mirror across symmetry plane (tripo)."
        },
        "fold": {
          "type": "array",
          "items": { "type": "string" },
          "description": "Bones to fold into their parent during re-rooting (tripo)."
        },
        "discard": {
          "type": "array",
          "items": { "type": "string" },
          "description": "Bones to discard with their subtrees (tripo)."
        },
        "chains": {
          "description": "Bone chain definitions for build or placed kinds.",
          "oneOf": [
            {
              "type": "array",
              "items": { "$ref": "#/$defs/chainDefinition" }
            },
            {
              "type": "object",
              "additionalProperties": { "type": "string" }
            }
          ]
        },
        "jaw": {
          "type": "object",
          "description": "Jaw bone placement and binding parameters.",
          "properties": {
            "hinge": { "$ref": "#/$defs/vec3" },
            "tip": { "$ref": "#/$defs/vec3" },
            "band": { "type": "number", "minimum": 0 }
          },
          "required": ["hinge", "tip"]
        },
        "head_line": {
          "type": "object",
          "description": "Head and snout guide line.",
          "properties": {
            "head": { "$ref": "#/$defs/vec3" },
            "chin": { "$ref": "#/$defs/vec3" },
            "top": { "$ref": "#/$defs/vec3" }
          }
        },
        "add_tail": {
          "type": "object",
          "description": "Appends a segmented tail chain.",
          "properties": {
            "start": { "$ref": "#/$defs/vec3" },
            "tip": { "$ref": "#/$defs/vec3" },
            "bones": { "type": "integer", "minimum": 1 }
          }
        },
        "hard_split": {
          "type": "object",
          "description": "A lid: everything above a height rides one bone, everything below another (rerig.skin).",
          "properties": {
            "bone": { "type": "string" },
            "else": { "type": "string" },
            "above": { "type": "number", "minimum": 0, "maximum": 1 }
          },
          "required": ["bone", "else", "above"]
        },
        "parts": {
          "description": "Two uses of one key: body-part bone ownership rules (placed kind: an object, or a list of {bones, allow, deny}), or, with rigid_parts, the machine parts that ride a bone whole (a list of {bone, at, verts}).",
          "oneOf": [
            {
              "type": "object",
              "additionalProperties": {
                "oneOf": [
                  { "type": "array", "items": { "type": "string" } },
                  {
                    "type": "object",
                    "properties": {
                      "bones": { "type": "array", "items": { "type": "string" } },
                      "allow": { "type": "array", "items": { "type": "string" } },
                      "deny": { "type": "array", "items": { "type": "string" } }
                    }
                  }
                ]
              }
            },
            {
              "type": "array",
              "items": {
                "type": "object",
                "properties": {
                  "name": { "type": "string" },
                  "bones": { "type": "array", "items": { "type": "string" } },
                  "allow": { "type": "array", "items": { "type": "string" } },
                  "deny": { "type": "array", "items": { "type": "string" } }
                },
                "required": ["bones"]
              }
            },
            {
              "type": "array",
              "items": {
                "type": "object",
                "properties": {
                  "bone": { "type": "string" },
                  "at": { "$ref": "#/$defs/vec3" },
                  "verts": { "type": "integer", "minimum": 1 }
                },
                "required": ["bone", "at", "verts"]
              }
            }
          ]
        },
        "blends": {
          "type": "array",
          "description": "Smooth join transition radii between body parts.",
          "items": {
            "oneOf": [
              {
                "type": "object",
                "properties": {
                  "bone": { "type": "string" },
                  "with": { "type": "string" },
                  "radius": { "type": "number", "minimum": 0 },
                  "fade": { "type": "number", "minimum": 0 }
                },
                "required": ["bone", "with"]
              },
              {
                "type": "array",
                "items": { "type": "string" },
                "minItems": 2,
                "maxItems": 2
              }
            ]
          }
        },
        "rip_welds": {
          "type": "array",
          "description": "Seams between parts to rip apart before skinning to prevent tearing.",
          "items": {
            "type": "array",
            "items": { "type": "string" },
            "minItems": 2,
            "maxItems": 2
          }
        },
        "membranes": {
          "type": "array",
          "description": "Wing or fin membrane distance gradient binding rules.",
          "items": {
            "type": "object",
            "properties": {
              "name": { "type": "string" },
              "bones": { "type": "array", "items": { "type": "string" } },
              "root_bone": { "type": "string" },
              "cut_flank": { "type": "boolean" },
              "gradient": { "type": "number" },
              "span_power": { "type": "number" }
            },
            "required": ["name", "bones"]
          }
        },
        "rigid_islands": {
          "description": "Loose pieces locked 100% to one bone (armour plates, buckles). \"auto\" or true: every small loose piece to its dominant or nearest bone (the humanoid kind's default; for the other kinds it is off unless set, or unless rigid_armor, armor or accessories is); false or \"off\": none; a list: the pieces named, by \"island\" index, \"at\" (0..1) or \"box\" (two corners, 0..1).",
          "oneOf": [
            { "type": "boolean" },
            { "type": "string", "enum": ["auto", "off"] },
            {
              "type": "array",
              "items": {
                "type": "object",
                "properties": {
                  "bone": { "type": "string" },
                  "island": { "type": "integer", "minimum": 0 },
                  "at": { "$ref": "#/$defs/vec3" },
                  "box": { "type": "array", "items": { "$ref": "#/$defs/vec3" }, "minItems": 2, "maxItems": 2 },
                  "max_verts": { "type": "integer" },
                  "auto": { "type": "boolean" }
                },
                "required": ["bone"]
              }
            }
          ]
        },
        "envelope": {
          "description": "After bone heat: \"root\" (the default: no limb weight behind where the limb starts), \"full\" (the torso to the spine, each limb to a capsule round it; joint_blend and limb_radius tune it), false (plain bone heat).",
          "enum": ["root", "full", false]
        },
        "skinning": {
          "description": "\"bone-heat\" (the default: bone heat on the mesh, a voxel copy only when it fails) or \"proxy-transfer\" (bone heat on a watertight voxel copy, its weights carried back by robust transfer).",
          "enum": ["bone-heat", "proxy-transfer"]
        },
        "proxy_voxel": { "type": "number", "exclusiveMinimum": 0, "maximum": 0.2, "description": "proxy-transfer: the voxel size tried first, a fraction of the longest side (then 0.016, 0.022, 0.012, 0.03)." },
        "transfer_distance": { "type": "number", "exclusiveMinimum": 0, "maximum": 1, "description": "proxy-transfer: how far a vertex may be from the voxel copy's surface and still copy its weights, a fraction of the longest side (default 2.5 voxels)." },
        "transfer_angle": { "type": "number", "minimum": 0, "maximum": 180, "description": "proxy-transfer: the most the normals may disagree, in degrees, either way round (default 30)." },
        "smooth": { "type": "integer", "minimum": 0, "description": "Weight smoothing passes (run before the barrier)." },
        "barrier": { "type": "boolean", "description": "Air-gap barriers between limbs (default true); the standing-body rules in it run for bipeds only." },
        "armpit_barrier": { "type": "boolean" },
        "flank_barrier": { "type": "boolean", "description": "Front limbs off the rump, hind limbs off the chest (quadrupeds and multi-legged bodies)." },
        "tail_barrier": { "type": "boolean" },
        "radial_barrier": { "type": "boolean", "description": "Each leg of a multi-legged body kept to its own sector around the body." },
        "crotch_barrier": { "type": "number", "minimum": 0, "description": "Width of the seam fade between the legs, in model units (default 3% of the model's size)." },
        "sym_plane": { "type": "number", "description": "X of the symmetry plane (default 0)." },
        "sibling_isolation": { "type": "boolean" },
        "centerline_armor": { "type": "boolean", "description": "Small loose pieces across the pelvis ride the hips; on a biped, the crotch seam blends to the hips." },
        "hinge_smoothing": { "type": "boolean" },
        "hinge_passes": { "type": "integer", "minimum": 0 },
        "hinge_max_gradient": { "type": "number", "minimum": 0 },
        "hinge_radius_scale": { "type": "number", "minimum": 0 },
        "hinges": { "type": "array", "items": { "type": "array", "items": { "type": "string" }, "minItems": 2, "maxItems": 2 } },
        "twist_relaxation": { "type": "boolean" },
        "twist_passes": { "type": "integer", "minimum": 0 },
        "twist_max_gradient": { "type": "number", "minimum": 0 },
        "twist_radius_scale": { "type": "number", "minimum": 0 },
        "twist_pairs": { "type": "array", "items": { "type": "array", "items": { "type": "string" }, "minItems": 2, "maxItems": 2 } },
        "auto_heal": { "type": "boolean", "description": "The closing smoothing of steep weight steps; never touches deliberate cuts." },
        "heal_validate": { "type": "boolean", "description": "Trial the healer against sampled bends and twists; roll back if deformation worsens. Default true." },
        "audit_motion_ranges": { "type": "object", "description": "Bone name to bend/twist angle lists in degrees; defaults are bend 40, twist 60.", "additionalProperties": { "type": "object", "properties": { "bend": { "type": "array", "minItems": 1, "maxItems": 12, "items": { "type": "number", "minimum": -180, "maximum": 180 } }, "twist": { "type": "array", "minItems": 1, "maxItems": 12, "items": { "type": "number", "minimum": -180, "maximum": 180 } } }, "additionalProperties": false } },
        "heal_max_gradient": { "type": "number", "minimum": 0 },
        "heal_passes": { "type": "integer", "minimum": 0 },
        "heal_blend": { "type": "number", "minimum": 0, "maximum": 1 },
        "rigid_armor": { "type": "boolean" },
        "rigid_island_max_share": { "type": "number", "minimum": 0, "maximum": 1, "description": "Largest automatic rigid piece, as a share of all vertices (default 0.1)." },
        "rigid_island_max_extent": { "type": "number", "minimum": 0, "maximum": 1, "description": "Largest automatic rigid piece, as a share of the model's longest side (default 0.25): a garment longer than this still bends." },
        "mesh_heal": { "type": "boolean" },
        "keep_inside": { "type": "boolean" },
        "twist_bones": { "type": "boolean" },
        "morph_targets": { "type": "boolean" },
        "digits": { "type": "boolean" },
        "audit": {
          "type": "object",
          "description": "Audit check allowances override for this model (requires notes['rig.audit']).",
          "properties": {
            "bleed_pct": { "type": "number" },
            "combined_tears": { "type": "integer" },
            "bend_tears": { "type": "integer" },
            "head_pct": { "type": "number" },
            "max_influences": { "type": "integer" }
          },
          "additionalProperties": false
        }
      },
      "required": ["kind"]
    },
    "humanoid": {
      "type": "object",
      "description": "Measurements for standard biped skeleton (kind: 'humanoid').",
      "properties": {
        "forward": { "$ref": "#/$defs/vec3" },
        "z": {
          "type": "object",
          "description": "Z height coordinates (0..1 of model height).",
          "properties": {
            "top": { "type": "number" },
            "head": { "type": "number" },
            "neck": { "type": "number" },
            "arm": { "type": "number" },
            "spine2": { "type": "number" },
            "spine1": { "type": "number" },
            "spine": { "type": "number" },
            "hip": { "type": "number" },
            "knee": { "type": "number" },
            "ankle": { "type": "number" }
          },
          "required": ["top", "head", "neck", "arm", "spine2", "spine1", "spine", "hip", "knee", "ankle"]
        },
        "x": {
          "type": "object",
          "description": "X half-span coordinates (0..0.5 from centerline).",
          "properties": {
            "shoulder": { "type": "number" },
            "elbow": { "type": "number" },
            "wrist": { "type": "number" },
            "knuckle": { "type": "number" },
            "tip": { "type": "number" }
          },
          "required": ["shoulder", "elbow", "wrist", "knuckle", "tip"]
        }
      },
      "required": ["z", "x"]
    },
    "budget": {
      "type": ["integer", "null"],
      "minimum": 1,
      "description": "Engine decimation triangle budget target. Null keeps full resolution."
    },
    "clips": {
      "type": "object",
      "description": "Animation clips configuration for procedural generation.",
      "properties": {
        "archetype": {
          "type": "string",
          "enum": ["walker", "flyer", "exploder", "swimmer", "turret", "winged", "machine"],
          "description": "Clip authoring archetype."
        },
        "display": { "type": "string" },
        "category": { "type": "string" },
        "attack": { "type": "string" },
        "windup": { "type": "string" },
        "hit_rear": { "type": "number" },
        "beats": { "type": "number" },
        "flap": { "type": "number" },
        "loop": { "type": "integer" }
      },
      "required": ["archetype"]
    },
    "card": {
      "type": "object",
      "description": "Engine metadata card published with the rigged assets.",
      "properties": {
        "metres": { "type": "number", "minimum": 0 },
        "role": { "type": "string" },
        "tint": { "type": "string" }
      }
    },
    "notes": {
      "type": "object",
      "description": "Explanations and rationale for allowances or non-default options.",
      "properties": {
        "rig.audit": { "type": "string" },
        "budget": { "type": "string" },
        "clips": { "type": "string" }
      },
      "additionalProperties": { "type": "string" }
    }
  },
  "required": ["schema", "rig"],
  "$defs": {
    "vec3": {
      "type": "array",
      "items": { "type": "number" },
      "minItems": 3,
      "maxItems": 3
    },
    "chainDefinition": {
      "type": "object",
      "properties": {
        "name": { "type": "string" },
        "role": { "type": "string" },
        "slice": {
          "type": "array",
          "items": { "type": "number" },
          "minItems": 2,
          "maxItems": 2
        },
        "tube": {
          "type": "array",
          "items": { "$ref": "#/$defs/vec3" },
          "minItems": 2,
          "maxItems": 2
        },
        "points": {
          "type": "array",
          "items": { "$ref": "#/$defs/vec3" },
          "minItems": 2
        },
        "tip": { "$ref": "#/$defs/vec3" },
        "base": { "$ref": "#/$defs/vec3" },
        "stations": {
          "type": "array",
          "items": { "type": "number" }
        },
        "bones": { "type": "integer", "minimum": 1 },
        "names": {
          "type": "array",
          "items": { "type": "string" }
        },
        "parent": {
          "oneOf": [
            { "type": "string" },
            {
              "type": "array",
              "prefixItems": [
                { "type": "string" },
                { "type": "integer" }
              ],
              "items": false
            }
          ]
        }
      },
      "required": ["name"]
    }
  }
}
