{
  "schema": "autorig-spec/1",
  "rig": {
    "kind": "placed",
    "forward": [
      0,
      -1,
      0
    ],
    "chains": [
      {
        "name": "spine",
        "points": [
          [
            0.5,
            0.8,
            0.65
          ],
          [
            0.5,
            0.55,
            0.67
          ],
          [
            0.5,
            0.3,
            0.65
          ],
          [
            0.5,
            0.18,
            0.62
          ],
          [
            0.5,
            0.02,
            0.6
          ]
        ],
        "names": [
          "hips",
          "spine_1",
          "neck",
          "head"
        ]
      },
      {
        "name": "leg_front.L",
        "points": [
          [
            0.8,
            0.34,
            0.42
          ],
          [
            0.95,
            0.3,
            0.02
          ]
        ],
        "bones": 2,
        "parent": [
          "spine",
          2
        ]
      },
      {
        "name": "leg_front.R",
        "points": [
          [
            0.2,
            0.34,
            0.42
          ],
          [
            0.05,
            0.3,
            0.02
          ]
        ],
        "bones": 2,
        "parent": [
          "spine",
          2
        ]
      },
      {
        "name": "leg_mid.L",
        "points": [
          [
            0.82,
            0.54,
            0.42
          ],
          [
            0.96,
            0.54,
            0.02
          ]
        ],
        "bones": 2,
        "parent": [
          "spine",
          1
        ]
      },
      {
        "name": "leg_mid.R",
        "points": [
          [
            0.18,
            0.54,
            0.42
          ],
          [
            0.04,
            0.54,
            0.02
          ]
        ],
        "bones": 2,
        "parent": [
          "spine",
          1
        ]
      },
      {
        "name": "leg_back.L",
        "points": [
          [
            0.8,
            0.76,
            0.42
          ],
          [
            0.95,
            0.8,
            0.02
          ]
        ],
        "bones": 2,
        "parent": [
          "spine",
          0
        ]
      },
      {
        "name": "leg_back.R",
        "points": [
          [
            0.2,
            0.76,
            0.42
          ],
          [
            0.05,
            0.8,
            0.02
          ]
        ],
        "bones": 2,
        "parent": [
          "spine",
          0
        ]
      }
    ]
  },
  "budget": 1400,
  "clips": {
    "archetype": "walker",
    "display": "Beetle",
    "category": "Critters"
  },
  "card": {
    "metres": 0.8,
    "role": "creature"
  },
  "notes": {
    "rig": "Six-legged hexapod beetle"
  }
}
